{
  "$schema": "https://json-schema.org/draft/2020-12/schema",
  "$id": "https://aieng.dev/schemas/external_tool_requirements.schema.json",
  "title": ".aieng external tool requirements",
  "description": "Structured handoff contract describing which external CAD/CAE/runtime capabilities are required, which candidate tools may provide them, and what evidence must be written back after execution. .aieng records this contract; external tools execute.",
  "type": "object",
  "required": [
    "format_version",
    "handoff_id",
    "required_capabilities",
    "candidate_tools",
    "handoff_policy",
    "writeback_requirements",
    "forbidden_core_actions"
  ],
  "properties": {
    "format_version": {
      "type": "string",
      "const": "0.1.0"
    },
    "handoff_id": {
      "type": "string",
      "minLength": 1,
      "description": "Stable handoff identifier."
    },
    "source_task_id": {
      "type": "string",
      "minLength": 1,
      "description": "Optional: task_id from task/task_spec.yaml if a task spec is present."
    },
    "required_capabilities": {
      "type": "array",
      "items": {
        "type": "object",
        "required": ["capability", "tool_role", "required"],
        "properties": {
          "capability": {
            "type": "string",
            "minLength": 1,
            "description": "Named capability required for this handoff."
          },
          "tool_role": {
            "type": "string",
            "enum": ["agent_runtime", "cad_runtime", "cae_runtime", "cae_preprocessor", "solver"],
            "description": "Category of external tool that provides this capability."
          },
          "required": {
            "type": "boolean",
            "description": "Whether this capability is mandatory for task completion."
          },
          "reason": {
            "type": "string",
            "description": "Human-readable reason this capability is listed."
          }
        },
        "additionalProperties": false
      },
      "description": "Capabilities that external tools must provide for this handoff."
    },
    "candidate_tools": {
      "type": "array",
      "items": {
        "type": "object",
        "required": ["tool_id", "tool_role", "status", "capabilities"],
        "properties": {
          "tool_id": {
            "type": "string",
            "minLength": 1,
            "description": "Identifier for the candidate tool."
          },
          "tool_role": {
            "type": "string",
            "enum": ["agent_runtime", "cad_runtime", "cae_runtime", "cae_preprocessor", "solver"],
            "description": "Role of this candidate tool."
          },
          "status": {
            "type": "string",
            "enum": ["candidate", "active", "unavailable"],
            "description": "Availability status. 'candidate' means not installed or confirmed available."
          },
          "capabilities": {
            "type": "array",
            "items": {"type": "string"},
            "description": "Capabilities this tool provides."
          },
          "notes": {
            "type": "string",
            "description": "Optional notes about this candidate tool."
          }
        },
        "additionalProperties": false
      },
      "description": "External tools that may satisfy required capabilities. Status 'candidate' means not installed or confirmed available by .aieng."
    },
    "handoff_policy": {
      "type": "object",
      "required": [
        "bounded_steps_only",
        "inspect_before_execution",
        "reinspect_after_external_change",
        "record_artifacts",
        "record_tool_trace",
        "external_tools_execute",
        "aieng_core_executes_external_tools"
      ],
      "properties": {
        "bounded_steps_only": {
          "type": "boolean",
          "const": true,
          "description": "Must be true. External tools must execute bounded, inspectable steps only."
        },
        "inspect_before_execution": {
          "type": "boolean",
          "const": true,
          "description": "Must be true. Agent must inspect package state before instructing external tool execution."
        },
        "reinspect_after_external_change": {
          "type": "boolean",
          "const": true,
          "description": "Must be true. Agent must re-inspect package after any external tool writes back."
        },
        "record_artifacts": {
          "type": "boolean",
          "const": true,
          "description": "Must be true. All artifacts produced by external tools must be recorded."
        },
        "record_tool_trace": {
          "type": "boolean",
          "const": true,
          "description": "Must be true. Tool execution traces must be recorded for auditability."
        },
        "external_tools_execute": {
          "type": "boolean",
          "const": true,
          "description": "Must be true. CAD modification, mesh generation, solver execution, and result generation are performed by external tools only."
        },
        "aieng_core_executes_external_tools": {
          "type": "boolean",
          "const": false,
          "description": "Must be false. .aieng core does not invoke CAD kernels, meshers, solvers, or manufacturing checkers."
        }
      },
      "additionalProperties": false,
      "description": "Handoff policy constraints. All flags enforce the execution boundary between .aieng and external CAD/CAE tools."
    },
    "writeback_requirements": {
      "type": "array",
      "items": {"type": "string"},
      "minItems": 1,
      "description": "Evidence items that external tools must write back before the handoff outcome can be accepted."
    },
    "forbidden_core_actions": {
      "type": "array",
      "items": {"type": "string"},
      "minItems": 1,
      "description": "Actions that .aieng core must never perform. External tools are responsible for these."
    }
  },
  "additionalProperties": false,
  "$comment": "Phase 14B: external tool handoff contract. handoff_policy.external_tools_execute must be true and aieng_core_executes_external_tools must be false. These are hard execution-boundary guards enforced by schema const constraints."
}
