{
  "candidate_tools": [
    {
      "capabilities": [
        "inspect_current_state",
        "run_workflow",
        "writeback_evidence"
      ],
      "notes": "External execution/testbed candidate; not a core dependency.",
      "status": "candidate",
      "tool_id": "mechanical_agent",
      "tool_role": "agent_runtime"
    },
    {
      "capabilities": [
        "check_solver",
        "execute_bounded_step",
        "collect_artifacts"
      ],
      "notes": "Inspired by SVD AI Lab sim-cli style runtime; optional external adapter only.",
      "status": "candidate",
      "tool_id": "sim_cli",
      "tool_role": "cae_runtime"
    },
    {
      "capabilities": [
        "modify_cad_geometry",
        "export_step"
      ],
      "notes": "External CAD runtime.",
      "status": "candidate",
      "tool_id": "freecad",
      "tool_role": "cad_runtime"
    },
    {
      "capabilities": [
        "run_solver",
        "export_solver_artifacts"
      ],
      "notes": "External solver runtime.",
      "status": "candidate",
      "tool_id": "calculix",
      "tool_role": "solver"
    }
  ],
  "forbidden_core_actions": [
    "modify_cad_geometry",
    "generate_mesh",
    "run_solver",
    "claim_solver_validated_results",
    "claim_manufacturing_validity"
  ],
  "format_version": "0.1.0",
  "handoff_id": "handoff_001",
  "handoff_policy": {
    "aieng_core_executes_external_tools": false,
    "bounded_steps_only": true,
    "external_tools_execute": true,
    "inspect_before_execution": true,
    "record_artifacts": true,
    "record_tool_trace": true,
    "reinspect_after_external_change": true
  },
  "required_capabilities": [
    {
      "capability": "inspect_current_state",
      "reason": "Agent must inspect package state before proposing actions.",
      "required": true,
      "tool_role": "agent_runtime"
    },
    {
      "capability": "modify_cad_geometry",
      "reason": "Only needed after an accepted geometry-modification proposal.",
      "required": false,
      "tool_role": "cad_runtime"
    },
    {
      "capability": "generate_mesh",
      "reason": "Mesh generation must be done by external CAE software.",
      "required": false,
      "tool_role": "cae_preprocessor"
    },
    {
      "capability": "run_solver",
      "reason": "Solver execution must be done by external CAE software.",
      "required": false,
      "tool_role": "solver"
    },
    {
      "capability": "export_solver_artifacts",
      "reason": "Solver artifacts are needed before stress/displacement claims.",
      "required": false,
      "tool_role": "solver"
    }
  ],
  "source_task_id": "task_001",
  "writeback_requirements": [
    "validation_status_update",
    "artifact_provenance",
    "evidence_index_update",
    "claim_map_update",
    "tool_trace"
  ]
}
